{
  "$schema": "./main-web-visual-contract.schema.json",
  "version": 1,
  "baseline": {
    "branch": "main",
    "commit": "6c0e56daa5460a9725ee00b8937124d390e9bd0b",
    "stylesheet": "api/static/app.css",
    "layoutTemplate": "api/templates/layouts/web.html"
  },
  "viewports": [
    { "name": "mobile", "width": 390, "height": 844 },
    { "name": "tablet", "width": 768, "height": 1024 },
    { "name": "desktop", "width": 1280, "height": 800 },
    { "name": "wide", "width": 1440, "height": 900 }
  ],
  "tokens": {
    "topbarHeight": "58px", "controlHeight": "40px", "controlHeightSmall": "32px", "controlRadius": "8px", "cardRadius": "16px",
    "light": { "background": "#edf1f5", "panel": "#ffffff", "text": "#17212b", "muted": "#6b7785", "line": "#dfe6ed", "brand": "#376b9b", "accent": "#2d8a68", "danger": "#b42318" },
    "dark": { "background": "#0f1723", "panel": "#151f2d", "text": "#e6edf5", "muted": "#91a1b4", "line": "#293548", "brand": "#78a7cf", "accent": "#5ad09a", "danger": "#ff8078" }
  },
  "breakpoints": [1280, 1100, 980, 920, 900, 860, 760, 620],
  "globalShell": {
    "regionOrder": ["topbar", "main"],
    "mainScrollContainer": ".main",
    "geometryTolerancePx": 2,
    "computedStyleProperties": ["display", "position", "width", "height", "padding", "margin", "background-color", "color", "border", "border-radius", "box-shadow", "font-size", "font-weight", "line-height"]
  },
  "pages": [
    { "id": "page.boundary.login", "route": "/web/login", "family": "boundary", "visualUnit": "V10", "baselineSources": ["api/templates/web/login.html", "api/templates/layouts/auth.html", "api/static/app.css"], "fixture": { "status": "stable", "actor": "anonymous", "dataSet": "login-default" }, "evidenceMode": "boundary", "regionOrder": ["auth-copy", "login-form"], "stableAnchors": ["form", "input[name=username]"], "geometryAnchors": [".auth-shell"], "computedStyleProperties": ["display", "background-color"], "responsiveExpectations": { "mobile": "单列登录表单", "tablet": "按基线折叠认证布局", "desktop": "左右认证布局", "wide": "认证内容保持最大宽度" }, "states": ["normal", "error"], "dynamicMasks": [], "severity": "S3", "status": "boundary-only" },
    { "id": "page.boundary.bootstrap", "route": "/web/bootstrap", "family": "boundary", "visualUnit": "V10", "baselineSources": ["api/templates/web/bootstrap.html", "api/templates/layouts/auth.html", "api/static/app.css"], "fixture": { "status": "stable", "actor": "anonymous", "dataSet": "uninitialized-instance" }, "evidenceMode": "boundary", "regionOrder": ["auth-copy", "bootstrap-form"], "stableAnchors": ["form", "input[name=username]"], "geometryAnchors": [".auth-shell"], "computedStyleProperties": ["display", "background-color"], "responsiveExpectations": { "mobile": "单列初始化表单", "tablet": "按基线折叠认证布局", "desktop": "左右认证布局", "wide": "认证内容保持最大宽度" }, "states": ["normal", "error"], "dynamicMasks": [], "severity": "S3", "status": "boundary-only" },
    { "id": "page.boundary.device-authorization", "route": "/web/device-authorization", "family": "boundary", "visualUnit": "V10", "baselineSources": ["api/templates/web/device_authorization.html", "api/templates/web/device_authorization_result.html"], "fixture": { "status": "not-applicable", "actor": "authenticated-user", "dataSet": "desktop-device-code" }, "evidenceMode": "no-baseline", "regionOrder": ["device-summary", "authorization-actions"], "stableAnchors": ["form"], "geometryAnchors": [".auth-shell"], "computedStyleProperties": ["background-color"], "responsiveExpectations": { "mobile": "单列授权内容", "tablet": "授权内容居中", "desktop": "授权内容居中", "wide": "授权内容保持最大宽度" }, "states": ["pending", "approved", "denied", "expired"], "dynamicMasks": [], "severity": "N/A", "status": "boundary-only" },
    { "id": "page.boundary.downloads", "route": "/web/downloads", "family": "boundary", "visualUnit": "V10", "baselineSources": ["api/templates/web/desktop_downloads.html", "api/static/desktop-downloads.css"], "fixture": { "status": "stable", "actor": "anonymous", "dataSet": "release-assets" }, "evidenceMode": "boundary", "regionOrder": ["masthead", "release-intro", "platform-grid", "footnote"], "stableAnchors": [".masthead", ".release-intro", ".platform-grid"], "geometryAnchors": [".page", ".platform-grid"], "computedStyleProperties": ["display", "grid-template-columns", "gap", "padding", "font-size", "line-height"], "responsiveExpectations": { "mobile": "平台卡单列", "tablet": "平台卡单列", "desktop": "平台卡三列", "wide": "内容保持基线最大宽度" }, "states": ["normal", "empty", "asset-unavailable"], "dynamicMasks": [{ "selector": ".release-meta span:last-child", "kind": "text", "reason": "clock" }], "severity": "S2", "status": "matched" },
    { "id": "page.shell.dashboard", "route": "/web", "family": "shell", "visualUnit": "V2", "baselineSources": ["api/templates/web/dashboard.html", "api/templates/layouts/web.html", "api/static/app.css"], "fixture": { "status": "stable", "actor": "system-admin", "dataSet": "local-admin-demo" }, "evidenceMode": "runtime", "regionOrder": ["metrics", "project-table", "discussion-activity-grid"], "stableAnchors": [".metric-grid", ".compact-table", ".workspace-side"], "geometryAnchors": [".main", ".metric-grid", ".workspace-grid"], "computedStyleProperties": ["display", "grid-template-columns", "gap", "padding", "background-color"], "responsiveExpectations": { "mobile": "指标与双栏按基线转单列", "tablet": "内容栅格按基线降级", "desktop": "四指标与讨论动态双栏", "wide": "主内容保持基线最大宽度" }, "states": ["normal", "loading", "empty", "error"], "dynamicMasks": [{ "selector": ".activity-list span", "kind": "text", "reason": "clock" }], "severity": "S1", "status": "matched" },
    { "id": "page.personal.profile", "route": "/web/me", "family": "personal", "visualUnit": "V3", "baselineSources": ["api/templates/web/me.html", "api/static/app.css"], "fixture": { "status": "stable", "actor": "system-admin", "dataSet": "local-admin-demo" }, "evidenceMode": "runtime", "regionOrder": ["profile-hero", "metrics", "tokens", "projects", "security"], "stableAnchors": [".profile-hero", ".profile-metrics", ".api-token-panel"], "geometryAnchors": [".main", ".profile-hero", ".profile-metrics"], "computedStyleProperties": ["display", "grid-template-columns", "padding", "border-radius", "font-size"], "responsiveExpectations": { "mobile": "个人信息和指标单列", "tablet": "面板按基线降级", "desktop": "指标与安全区完整展开", "wide": "内容保持基线最大宽度" }, "states": ["normal", "loading", "empty", "error", "modal"], "dynamicMasks": [{ "selector": ".profile-hero-details", "kind": "text", "reason": "clock" }], "severity": "S1", "status": "matched" },
    { "id": "page.message-search.messages", "route": "/web/messages", "family": "message-search", "visualUnit": "V3", "baselineSources": ["api/templates/web/messages.html", "api/static/app.css"], "fixture": { "status": "stable", "actor": "system-admin", "dataSet": "notifications" }, "evidenceMode": "runtime", "regionOrder": ["compact-heading", "tabs", "message-list", "pager"], "stableAnchors": [".page-heading", ".yc-content-tabs", ".message-list"], "geometryAnchors": [".main", ".yc-content-tabs", ".message-list"], "computedStyleProperties": ["display", "gap", "padding", "border-color", "font-size"], "responsiveExpectations": { "mobile": "消息行单列且操作不溢出", "tablet": "消息内容保持紧凑", "desktop": "紧凑消息列表", "wide": "内容保持基线最大宽度" }, "states": ["normal", "loading", "empty", "error", "unread"], "dynamicMasks": [{ "selector": ".message-content small", "kind": "text", "reason": "clock" }], "severity": "S1", "status": "matched" },
    { "id": "page.message-search.search", "route": "/web/search", "family": "message-search", "visualUnit": "V3", "baselineSources": ["api/templates/web/search.html", "api/static/app.css"], "fixture": { "status": "stable", "actor": "system-admin", "dataSet": "search-results" }, "evidenceMode": "runtime", "regionOrder": ["page-hero", "search-panel", "result-groups", "pager"], "stableAnchors": [".page-hero", ".search-panel", ".search-result-list"], "geometryAnchors": [".main", ".page-hero", ".search-panel"], "computedStyleProperties": ["display", "padding", "border-radius", "font-size"], "responsiveExpectations": { "mobile": "搜索控件换行且结果单列", "tablet": "结果组按基线降级", "desktop": "搜索面板与分组结果", "wide": "内容保持基线最大宽度" }, "states": ["normal", "loading", "empty", "error"], "dynamicMasks": [], "severity": "S1", "status": "matched" },
    { "id": "page.project.list", "route": "/web/projects", "family": "project", "visualUnit": "V4", "baselineSources": ["api/templates/web/projects.html", "api/static/app.css"], "fixture": { "status": "stable", "actor": "system-admin", "dataSet": "demo-projects" }, "evidenceMode": "runtime", "regionOrder": ["page-hero", "metrics", "status-tabs", "project-grid", "pager"], "stableAnchors": [".page-hero", ".project-list-metrics", ".project-card-grid"], "geometryAnchors": [".main", ".project-list-metrics", ".project-card-grid"], "computedStyleProperties": ["display", "grid-template-columns", "gap", "border-radius"], "responsiveExpectations": { "mobile": "指标与项目卡单列", "tablet": "项目卡栅格降级", "desktop": "三指标与项目卡栅格", "wide": "内容保持基线最大宽度" }, "states": ["normal", "loading", "empty", "error", "modal"], "dynamicMasks": [], "severity": "S1", "status": "matched" },
    { "id": "page.project.detail", "route": "/web/projects/{project_key}", "family": "project", "visualUnit": "V4", "baselineSources": ["api/templates/web/projects/detail.html", "api/static/app.css"], "fixture": { "status": "stable", "actor": "project-admin", "dataSet": "project-YCE" }, "evidenceMode": "runtime", "regionOrder": ["detail-hero", "metrics", "tabs", "overview-grid"], "stableAnchors": [".detail-hero", ".metrics", ".tabs", ".overview-grid"], "geometryAnchors": [".main", ".detail-hero", ".overview-grid"], "computedStyleProperties": ["display", "grid-template-columns", "gap", "padding", "font-size"], "responsiveExpectations": { "mobile": "详情区域按基线转单列", "tablet": "概览双栏降级", "desktop": "四指标与概览双栏", "wide": "详情内容保持基线最大宽度" }, "states": ["normal", "loading", "empty", "error", "modal"], "dynamicMasks": [], "severity": "S1", "status": "matched" },